full_name,description,filtered,top_topic,domain
chriskok/BotClassification-OSRS,Using Machine Learning algorithms to classify bots vs humans in Old School Runescape,school classify human bot runescape,4.0,others
mmcdermott/chexpertplusplus,"Source implementation and pointer to pre-trained models for Chexpert++, a BERT-based approximation to CheXpert for radiology report labeling.",report pre_train pointer approximation chexpert labeling radiology,2.0,prediction
chesterking123/NSW-Government-Virtual-Internship,This repository contains my work done on the virtual internship provided by Australia's NSW Government on part-time job analysis of the work force data.,government force time internship job australia virtual nsw,25.0,classification
bubabi/covid-19-forecasting,Analysis of forecasting methods using COVID-19 time series data.,data method analysis time_series covid_19 forecasting,2.0,prediction
dennybritz/papergraph,AI/ML citation graph with postgres + graphql,graph ai_ml citation graphql postgre,4.0,others
EshikaShah/Basic-Machine-Learning-Models,Hands on code in python for basic machine learning models.,model machine_learning,21.0,classification
EshikaShah/Skillship-internship-project-1-Prediction-of-a-patient-s-no_show-appointments,Skillship Foundation internship project.,internship skillship foundation,19.0,classification
luckystarufo/SIREN_out_of_sample_tests,A quick test of SIREN on out-of-sample tasks,task quick siren,27.0,prediction
huangxiang360729/yolov3-prune,prune filters and layers for yolov3,layer filter yolov3 prune,9.0,classification
junmoan/outlier-detection,"Outlier Detection using z-score, MAD, MSE, IQR, Isolation Forest, and DBSCAN",score forest dbscan iqr isolation mad mse outli,18.0,others
stuti24m/Number-Plate-Detection-using-RetinaNet,This is a part of Object Detection on Custom Dataset with TensorFlow 2 and Keras using Python.,dataset tensorflow_2 custom kera object_detection,21.0,classification
peiss/ant-learn-visualization,python Visualization，using pyecharts、matplotlib、seaborn,visualization matplotlib pyechart seaborn,4.0,others
kakshak07/High-Dimensional-Visualization-Techniques-and-analysis,"Analysis involved various methods to explore and organize the data, including clustering, force-directed layouts, and a timeline for navigating through time-series data. To further analyse temporal attributes, the timeline was distorted through a force directed layout to spatially position time points according to their similarity. Sammon mapping, a variant of MDS, was used as a visualization approach for gene expression data sets along with the heat map-based strategy has been presented for visualizing the U-matrix from self-organizing maps (SOM).",force layout direct organize timeline,17.0,classification
ajaychaudhary7/Image-Colorization,"Coloring Black & White Images with the help of Autoencoder, Variational Autoencoder, Generative Adversarial Networks",black network variational_autoencoder autoencoder color generative_adversarial white,8.0,classification
IshanSingh611/User-Based-Collaborative-Filtering,"There is one famous quote about customer relationship. The summary of the quote like this <b>""Customers don't know what they want until we show them.""</b> So Recommendation Systems will help customers to find information, product & services they might not have thought of.",summary customer service relationship famous customers quote,27.0,prediction
YonoHub/waymo_ros,This is a ROS package to connect Waymo open dataset to ROS,dataset package connect ros waymo,17.0,classification
tg-bomze/Style-Transfer-Collection,Colabs Collection of style transfer in photo and video,video colab collection photo style_transfer,9.0,classification
josephsdavid/cord-19-tools,Tools for helping out with COVID-19 research,tool research covid_19,12.0,classification
jackfrost1411/fire-detection,Fire detection using customized basic CNN and InceptionV3 model.,cnn detection inceptionv3 customize,15.0,classification
ammar1y/YouTube-Trending-Videos-Analysis-2019,Code used to perform an extensive analysis on all YouTube trending videos in 2019 for different countries.,video analysis perform trend youtube country extensive,6.0,classification
ravirajsinh45/implementation_of_RCNN,We implement RCNN algorithm for object detection from an Images.,image object_detection rcnn,9.0,classification
vignesh022/Classy-Fy,A User-personalized Playlist Filter for Spotify Music,spotify music user filter playlist personalized,6.0,classification
puthusseri/MainProject,The project was to generate the MCQ for reading comprehension. Guided by  Professor Baby Syla,guide baby comprehension mcq professor reading syla,23.0,classification
CodeByHarri/Candlestick-Trading-Analysis-Strategy,"Candlestick Trading, Analysis & Strategy",strategy analysis trading candlestick,13.0,classification
alexeypustynnikov/AM-VRP,"TF2 implementation of ""Attention, Learn to Solve Routing Problems!"" (arXiv:1803.08475) article.",problem learn tf2 attention article solve routing arxiv,20.0,others
dwromero/wavelet_networks,"Code repository of the paper ""Wavelet Networks: Scale Equivariant Learning From Raw Waveforms""  https://arxiv.org/abs/2006.05259",scale raw equivariant waveform wavelet,10.0,classification
himanshu2406/CNN-ai-pneumonia-detection,Detects whether a person has pneumonia or not based on a chest X-ray ; Has an accuracy of 98+ .,accuracy detect person chest_x ray pneumonia,23.0,classification
JoungheeKim/korean-question-answer-system,This is project to analyze korquad 2.0,analyze 2_0 korquad,10.0,classification
zzxvictor/YOLO_Explained,"If you want to understand how YOLO works, check out this step-by-step walkthrough of YOLO2 in TF2! ",tf2 check walkthrough step_step yolo yolo2,20.0,others
kulichevskiy/end-to-end,Code snippets for creation of your own end-to-end analytics system,analytic end_end snippet creation,9.0,classification
naplab/DSTRF,Dynamic Spectrotemporal Receptive Field Analysis,analysis dynamic field receptive spectrotemporal,28.0,classification
kdkalvik/mmWave-user-recognition,Gait Based User Recognition from mmWave Radar Data,user recognition gait mmwave radar,6.0,classification
stuti24m/Stock-price-prediction-model,Stock price prediction model using LSTM,model prediction lstm stock_price,21.0,classification
Deamoner/privyfilter,Privy filter is made to give the method for removing/accommodating for unethical bias in data.,method filter bias accommodate privy remove unethical,22.0,others
Friends-of-Tracking-Data-FoTD/mapping-match-events-in-Python,Luca Pappalardos code for working with and plotting Wyscout data,plot luca pappalardo wyscout,3.0,classification
uoneway/notion-to-github-pages,Shell scripts for auto uploading Notion note to GitHub Pages,auto note notion uploading,1.0,prediction
jskripchuk/Synth1GAN,A GAN to generate preset banks for famous and free VST plugin Synth1,generate gan famous bank plugin preset synth1 vst,13.0,classification
andrewRowlinson/expected-goals-thesis,A repository for analysis on Expected Goals using StatsBomb and Wyscout data,goal statsbomb wyscout expect,17.0,classification
Rajwrita/ML-DL-Projects,Beginners guide to the top Machine Learning and Deep Learning Projects. ,machine_learning deep_learning guide beginner,3.0,classification
IBMDeveloperUK/ML-For-Everyone,"Resources, notebooks, assets for ML for Everyone Twitch stream",stream resource ml asset twitch,5.0,others
RaminHasibi/SA_Net,Implementation of The paper SA_Net for point cloud completion,paper net cloud completion,1.0,prediction
emilyxxie/colab_utils_and_snippets,Some of my code snippets for Google Colab notebooks.,google_colab snippet,4.0,others
harley-wood-school-for-astronomy/HWSA2020,The 2020 Harley Wood School of Astronomy,school astronomy harley wood,4.0,others
VijayalaxmiH18/Real-time-Face-Mask-Detector-,A real-time face mask detector using Tensorflow and OpenCV,tensorflow opencv real_time detector face_mask,28.0,classification
sakshibutala/CNN_AlphabetRecognition,This algorithm is integrated with anvil website which identifies the alphabet present in the given input image.,identify website input integrate alphabet anvil,0.0,classification
morganpartee/capstone_kmer_compression,K-mer space DNA analysis with compression (currently) in python.,analysis compression dna space mer,17.0,classification
Devashi-Choudhary/Face-Mask-Detection,Face mask detection using deep learning algorithm.,deep_learning detection face_mask,28.0,classification
hugobowne/deep-learning-from-scratch-pytorch,Deep Learning from Scratch with PyTorch,pytorch deep_learning scratch,23.0,classification
Pawandeep-prog/keras-seq2seq-chatbot-with-attention,It is a seq2seq encoder decoder chatbot using keras and with attention,encoder kera attention seq2seq chatbot decoder,6.0,classification
miki998/YoloV4_PyTorch,Quick performance check of Pytorch implementation of YoloV4,pytorch performance quick check yolov4,4.0,others
amirebrahimi/quantumdojo,A Quantum Computing Dojo for improving your intuition,compute quantum dojo intuition,4.0,others
rakshakannu/COVID19,A flask web app that can predict the probability of a patient contracting COVID19.,predict probability patient covid19 app contracting flask_web,23.0,classification
horychen/PidTuner,My implementation of pid tunner following TI's InstaSPIN guide.,guide instaspin pid ti tunner,15.0,classification
parmarsuraj99/keras-transformer-flex,Transformer block in tf.keras similar to PyTorch's nn.Transformer block.,kera transformer block nn,23.0,classification
KhanradCoder/AIEmoRapGenerator,"Generated emo rap lyrics in the style of xxxtentacion, JuiceWRLD and Lil Peep",lyric rap style emo juicewrld lil peep xxxtentacion,1.0,prediction
Arpan-Mishra/Anime-Generation-using-Deep-Learning,Built text generation models using LSTM & GPT2,model lstm build text generation gpt2,21.0,classification
aickletfraid/PSNowGames,Game List for PS Now Games,game list ps,2.0,prediction
TheScript96/Semantic-code-search-using-BERT-and-transformer,Building a Semantic code search using BERT and transformer,build search bert transformer semantic,1.0,prediction
4OH4/doc-similarity,Ranking documents using semantic similarity in Python,similarity rank semantic document,1.0,prediction
nayash/stock_cnn_blog_pub,"This project is a loose implementation of paper ""Algorithmic Financial Trading with Deep Convolutional Neural Networks: Time Series to Image Conversion Approach""",time_series convolutional_neural financial deep algorithmic trading conversion loose,13.0,classification
Pavithran-R/rclone-colab,Script to run Rclone in Colab,run colab rclone,3.0,classification
Nishil07/Hands-on-Basics-of-Machine-Learning,This repository is for every beginner who just finished with the theoretical part of Machine Learning and wants to have a hands on experience of various kinds of algorithm and make predictions on a real time dataset.,prediction hand real_time experience beginner finish theoretical,27.0,prediction
sarwarisak/captcha,Solving Captchas using Deep Learning ,deep_learning solve captchas,20.0,others
Shikhar-S/NLP-Preprocessing,A preprocessing guide for NLP with python.,nlp guide preprocesse,15.0,classification
montoya-gamio/workshop-intro-numpy-pandas,June 30th online webinar,online june 30th webinar,6.0,classification
aashu0706/AV-Jantahack-Recommendation-system,"Approach to ""Analytics Vidhya Janatahack: Recommendation system""",recommendation analytic janatahack vidhya,0.0,classification
kaushikData/proFIT.AI,Predicting best fit for given job description using BERT BASE UNCASED pertained model,predict bert job description fit pertained uncased,25.0,classification
ChaosAdmStudent/DinoGameCNN,"In this project, I try to automate Google's dino game using Convolutional Neural Networks which makes use of computer vision to constantly predict the dino's move on the basis of the game objects' relative distance with respect to the dinosaur!",game distance relative basis dino constantly dinosaur respect,25.0,classification
jaeyk/intersectional-bias-in-ml,Intersectional bias in hate speech and abusive language datasets,language speech hate bias abusive intersectional,18.0,others
NetoPedro/Deep-Learning-Push-Up-Counter,Deep Learning approach to count the number of repetitions in a video of push ups or pull ups. ,video count pull push repetition,13.0,classification
jeffreyxparker/KDA,An example of using Key Driver Analysis,analysis key driver,2.0,prediction
hollance/reliability-diagrams,Reliability diagrams visualize whether a classifier model needs calibration,classifier visualize diagram calibration reliability,15.0,classification
LowriWilliams/Topic_Modelling_Beyond_Tokens,Investigating into how to extract meaningful topic names from textual data,extract investigate textual topic name meaningful,15.0,classification
kfit-dev/dynamic-singer,"Python API, Dynamic source, Dynamic target, N targets, Prometheus exporter, realtime transformation for Singer ETL",transformation dynamic target etl exporter prometheus realtime singer,24.0,prediction
garridoq/malis-project,Implementation and analysis of Maximin Affinity of Image Segmentation,analysis image segmentation affinity maximin,12.0,classification
datacamp/Hacker-Stats-in-Python-Live-Training,Live Training Session: Hacker Stats in Python,session stat live_training hacker,6.0,classification
sourav642/Title-Generation-of-Articles-using-Recurrent-Neural-Networks,"Final Year Project. Department of Computer Science and Engineering, Heritage Institute of Technology, Kolkata",institute computer science engineering technology department heritage kolkata,19.0,classification
ardhiraka/H8_SCL2020,Repository used for Shopee Code League Singapore 2020 talks. Topic: Natural Language Processing.,natural_language topic processing league talk shopee singapore,13.0,classification
MarcoForte/FBA_Matting,"Official repository for the paper F, B, Alpha Matting",paper alpha mat,20.0,others
manceps/fashion-mnist-kfp-lab,A notebook showing how to easily convert a current notebook you have to a notebook that can be run on Kubeflow Pipelines.,pipeline run convert current kubeflow easily,5.0,others
blainerothrock/seisml,A pytorch framework for building deep learning models with seismic data,data model pytorch deep_learning building framework seismic,2.0,prediction
himanshu2406/Ai-Doctor,"Machine learning discord bot , Detects diseases within seconds with just an xray scan",detect disease scan xray bot discord,12.0,classification
mperezcarrasco/PyTorch-DAGMM,Deep Autoencoding Gaussian Mixture Model for Unsupervised Anomaly Detection,anomaly_detection deep unsupervised mixture gaussian autoencoding,21.0,classification
Nishil07/Simple-Rnn-for-my-first-Medium-blog,This is the complete code for a simple Rnn which you just read about on Medium. I hope anyone who reads this finds it helpful.,rnn medium read helpful hope,15.0,classification
jingjingsky120/MachineLearning_101,Southern Data Science Conference Online Series ML101,series conference data_science online southern ml101,6.0,classification
franknb/Self-attention-DCGAN,An application of Self-Attention GANs and DCGAN on mnist dataset.,gan attention dcgan mnist_dataset,1.0,prediction
KimuraTian/sigir-eCom20-counterfactual-ltr-using-hte,Counterfactual Learning-to-Rank using Heterogeneous Treatment Effect Estimation,learning estimation treatment rank counterfactual heterogeneous,22.0,others
mk-gurucharan/TensorFlow-vs-PyTorch-CNN,This repository consists of the implementation of the code to build a CNN model with LeNet-5 Architecture in both TensorFlow and PyTorch frameworks.,architecture pytorch cnn build tensorflow framework lenet,15.0,classification
Sankalp679/SHALA,"MastAI ki paathSHALA : Data Science, Machine Learning, and Deep Learning",machine_learning deep_learning data_science mastai paathshala,4.0,others
GregBland/Robinhood_API_article,Repo container example code for Robinhood API article for algotrading101 (Lucas Liew),article api container algotrading101 liew lucas robinhood,22.0,others
jmoldon/coronavirus_analysis,Some exploratory analysis on the coronavirus evolution,analysis coronavirus evolution exploratory,3.0,classification
twiecki/covid19,Analyses about the COVID-19 virus,covid_19 virus analyse,6.0,classification
pabloinsente/intro-sc-python,"Python Tools for Data Science, Machine Learning, and Scientific computing",machine_learning data_science tool scientific computing,28.0,classification
benniatli/BrainAgePredictionResNet,3D residual neural network that predicts age based on brain MRI images (implemented using TensorFlow 2).,predict tensorflow_2 neural_network 3d brain residual age mri,27.0,prediction
darwin-a/PersonalProjects,Holds All Personal Projects For Darwin Agunos,personal hold aguno darwin,4.0,others
apurvsingh98/Face-Extraction-using-RetinaFace,Code for saving all the faces present in an image,image face save,9.0,classification
Abinaya-Krishnan/Australian_NewsTopics-ABCNews-analysis-using-Python,Analysis about top Australian news topics over last decade,analysis news topic australian decade,26.0,classification
Abinaya-Krishnan/Australian-House_Price_Index_Analysis-using-Python,Analysis about HPI and Economy,analysis economy hpi,2.0,prediction
ipuneetrathore/BERT_models,This repository contains fine tuned BERT models,model bert,21.0,classification
jhermann/blog,:page_with_curl: My fastpages blog.,blog curl fastpage,23.0,classification
KKhushhalR2405/BikeSharing,"In this project, I have build a neural network from scratch to carry out a prediction problem on a real dataset.",dataset problem real prediction neural_network build scratch carry,27.0,prediction
YC-Coder-Chen/feature-engineering-handbook,A practical feature engineering handbook,feature practical engineering handbook,19.0,classification
DmitrySerg/COVID-19,Modelling the disease spread,model spread disease,12.0,classification
d-eremeev/ADM-VRP,Dynamic Attention Model for Vehicle Routing Problem (arXiv:2002.03282),problem dynamic attention vehicle routing arxiv,19.0,classification
MIT-LCP/COVID-19,Analysis of high resolution clinical data for COVID-19 patients,data analysis clinical covid_19 patient resolution,0.0,classification
ermongroup/f-wgan,"Code for ""Bridging the Gap between f-GANs and Wasserstein GANs"", ICML 2020",gan wasserstein icml_2020 bridge gap,1.0,prediction
TanyaChutani/DeepLabV3Plus-Tf2.x,A Tensorflow implementation of Deep Lab V3 Plus from scratch.,deep tensorflow scratch lab v3,26.0,classification
asiskumarroy/Outfit-recommendation-system,A CNN based approach to recommend similar outfit based on a outfit chosen by the user,user recommend choose,6.0,classification
AgHarsh/Fault-Detection-in-Power-Microgrid,"This project presents the concept of fault detection and location in a Power Microgrid making use of the machine learning concepts like Artificial Neural Network. The electronic equipment used in microgrids is in essential need of more secure protection against short circuit faults. Due to the high current at the time of fault occurrence, the whole system might be de-energized which would have a severely negative impact on the entire system. A fault occurs when two or more conductors come in contact with each other or ground. Ground faults are considered as one of the main problems in power systems and account for more than 80% of all faults. An effective method to detect, isolate, and protect the power microgrid system against the effects of short circuit faults is extremely important. In this project we worked on a highly effective new method to protect the microgrid system using an Artificial Neural Network (ANN) that will detect and find the location of the fault before it affects other parts of the system. It would, therefore, be more dependable for microgrid protection. This protection network is distributed all along the power microgrid system protecting the entire microgrid network and is connected to the other protective devices in the system. This project focuses on detecting faults and identifying the location of the faults on electric power transmission lines in the power microgrid network.",power fault microgrid protection,4.0,others
AhmetFurkanDEMIR/Numpy,import numpy as np,numpy import,4.0,others
rbracco/covidcompare,Project to map covid19 risk in the US,risk map covid19,10.0,classification
Datatouille/sushirank,Educational implementation of pointwise and pairwise learning-to-rank models,learning rank educational pairwise pointwise,4.0,others
eugeneyan/poc-docker-template,Simple template showing how to set up docker for reproducible data science with Jupyter notebooks.,set data_science docker template reproducible,0.0,classification
vijayarajans92/Social_distancing_and_Mask_detection,CV model to detect social distancing and whether the person is wearing mask or not.,detect mask cv person_wear social_distancing,0.0,classification
acrarshin/RPNet,A Deep Learning approach for robust R Peak detection in noisy ECG.,deep_learning detection robust ecg peak noisy,9.0,classification
nikhilkumarsingh/choropleth-python-tutorial,Plotting Choropleth Maps using Python,plot map choropleth,3.0,classification
BrikerMan/tf2-101,Repository for Book 《TensorFlow 2.0 入门实践》,tensorflow_2 book,13.0,classification
drscotthawley/devblog3,another dev blog attempt,blog attempt dev,4.0,others
jason9693/UCK-GPT2,에브리타임(대학 커뮤니티) 게시글 생성기 (Online Community of Korea Universities Text Generator),text generator community online university korea,19.0,classification
dswh/fuel-consumption-end-to-end-ml,End to End Machine Learning Project on Fuel Consumption Prediction of 70s and 80s vehicles.,prediction machine_learning end_end vehicle consumption fuel,27.0,prediction
ashishshaji/EEG_Classification_Deeplearning,EEG Signal Classification using LSTM on various datasets ,dataset lstm classification eeg signal,21.0,classification
genome-in-a-bottle/genome-stratifications,"Stratification BED files from the Global Alliance for Genomics and Health (GA4GH) Benchmarking Team and the Genome in a Bottle Consortium.  These files can be used as standard resource of BED files for use with GA4GH benchmarking tools such as hap.py to stratify true positive, false positive, and false negative variant calls based on genomic context. ",positive false file bed benchmarke ga4gh genomic,26.0,classification
nmdoshi/HandsOnLabDOWS,Decision Optimization and Machine learning on IBM Watson Studio and Watson machine learning,machine_learning studio optimization decision ibm watson,28.0,classification
abhijitramesh/GAN-under-the-hood,This repository would contain detailed explanation of how GANs work and implementation of some GAN models,gan explanation detailed,1.0,prediction
YanXuHappygela/NLP-study,Learn to code for NLP,learn nlp,21.0,classification
Kenneth-Wong/het-eccv20,"Codes for ECCV paper: ""Sketching Image Gist: Human-Mimetic Hierarchical Scene Graph Generation""",generation human sketch hierarchical eccv gist mimetic scene_graph,8.0,classification
pranayKD/faster_rcnn_colab_pytorch,Implementation for E2E image detection and recognition algorithm - Faster RCNN (Pytorch),pytorch image detection recognition fast rcnn e2e,9.0,classification
priyatiru/Predicting-drug-abuse-behaviour,"This repository contains all the code files and output of the project carried out on the topic- Predicting Drug Abuse Behavior using Deep Learning technologies. The keywords used in the project are -  drugs, BERT, Tweepy, Twitter, timeline, students, depression, bag of words, drug abuse behavior, hash, cosine  similarities, LDA, multinomial naive bayes, linear support vector machine, random forest classifier, NLP, deep learning",drug behavior abuse,20.0,others
BLarzalere/LSTM-Autoencoder-for-Anomaly-Detection,"AI deep learning neural network for anomaly detection using Python, Keras and TensorFlow",deep_learning neural_network ai anomaly_detection kera_tensorflow,21.0,classification
xinyooo/deepfake-detection,DeepFake Detection: Detect the video is fake or not using InceptionResNetV2.,video detection detect fake deepfake inceptionresnetv2,8.0,classification
Lizhen0797/MMoE-TF2.0,MMoE-TF2.0,tf2 mmoe,28.0,classification
apurvsingh98/Kiss-detection-using-Xception,"This repository contains a basic implementation of supervised classification of detecting kiss in an image, using transfer learning",transfer_learn classification supervised detecting kiss,1.0,prediction
LLNL/al_nlp,Active Learning framework for Natural Language Processing of pathology reports.,learn natural_language report framework processing active pathology,13.0,classification
walesdata/2Dconv_pub,Predicting time series with a 2D convolution network,predict time_series network convolution 2d,24.0,prediction
vishaal27/LeVAsa,"Code for ""It’s LeVAsa not LevioSA! Latent Encodings for Valence-Arousal Structure Alignment""",arousal valence structure encoding latent alignment levasa leviosa,10.0,classification
tagordon/specgp,Gaussian processes for multi-wavelength and spectral observations ,observation multi spectral gaussian_process wavelength,10.0,classification
riya-dhama19/Kaggle_Titanic_Survival_Prediction,Create and Train Logistic Regression Model which predicts  whether a given passenger survived or not,predict train create logistic_regression passenger survive,23.0,classification
lopeselio/Brain-Tumor-Image-Segmentation-For-Magnetic-Resonance-Imaging,"Magnetic resonance imaging (MRI) is an advanced imaging technique that is used to observe a variety of diseases and parts of the body..neural networks can analyze these images individually (as a radiologist would) or combine them into a single 3D volume to make predictions.  At a high level, MRI works by measuring the radio waves emitting by atoms subjected to a magnetic field.",imaging mri atom emit individually magnetic radiologist,24.0,prediction
bitprj/curriculum,Democratizing Technical Education 🐮,technical democratize education,0.0,classification
