full_name,description,filtered,top_topic,domain
tmabraham/fastai_tpu,TPU support for the fastai library,library fastai support tpu,24.0,prediction
AnnaShtangey/Fashion-Detection-DeepFashion2-Detectron2-Flask,Fashion detection dataset DeepFashion2 framework Detectron2 +Flask,detection framework detectron2 fashion flask deepfashion2,12.0,classification
Tachionstrahl/SignLanguageRecognition,Real-time Recognition of german sign language (DGS) with MediaPipe,language recognition german sign real_time mediapipe dgs,28.0,classification
bknyaz/sgg,Train Scene Graph Generation for Visual Genome and GQA in PyTorch >= 1.2 with improved zero and few-shot generalization. ,train generation visual genome generalization shot scene_graph gqa,26.0,classification
skojaku/core-periphery-detection,Python package for detecting core-periphery structure in networks.,network structure package detect core periphery,1.0,prediction
hal-314/fastai-batch-size-finder, Implementation of OpenAI paper with Simple Noise Scale on Fastai V2,paper scale noise fastai_v2 openai,8.0,classification
theadamsabra/LearningfromAudio,Repository for the Medium series Learning from Audio by Adam Sabra,learn audio medium series adam sabra,23.0,classification
Harshita9511/Healthcare-ML-Web-Application,"Access to quality healthcare and doctors has always been a concern in developing countries and remote areas. To deal with such issues, this healthcare web application is developed. Healthcare data was fed to machine learning training models and engines for predictive modelling. The accuracy of these models is directly proportional to the training they get. These models will be able to predict the potential health risks to a patient a lot earlier so that they could take the preventive measures and live a long healthy life.",develop training healthcare concern proportional,5.0,others
jejjohnson/uncertain_gps,Exploring how to to deal with uncertain inputs with gaussian process regression models.,explore regression input gaussian_process deal uncertain,3.0,classification
asigalov61/Google-Magenta-Piano-Transformer-Colab,This is the only fully working and functioning version of Google Magenta Piano Transformer Colab Notebook.,function colab google transformer piano magenta,17.0,classification
epfl-dlab/YouNiverse,"Code for the dataset paper: ""YouNiverse: Large-Scale Channel and Video Metadata from English-Speaking YouTube""",video scale english channel youtube metadata speak youniverse,6.0,classification
AryanMethil/Mask-Detection,Face Mask Detection using Tensorflow to detect whether a person is wearing mask or not,detection tensorflow detect mask person_wear face_mask,0.0,classification
codingforentrepreneurs/Supercharged-Web-Scraping-with-Asyncio,"Scrape websites asynchronously with Python 3.8+, Asyncio, & arsenic (aka Selenium for Async).",scrape website async aka selenium arsenic asynchronously asyncio,22.0,others
dswh/voila-covid-19-dashboard,Voila Covid-19 Dashboard,dashboard covid_19 voila,12.0,classification
labmlai/samples,Example machine learning experiments that use LabML,machine_learning experiment,8.0,classification
giuseppeporcelli/end-to-end-ml-sm,End to end Machine Learning with Amazon SageMaker,machine_learning amazon_sagemaker end_end,22.0,others
Hsuan-Tung/universal_attack_natural_trigger,Natural Universal Trigger Search (NUTS),search trigger universal natural nut,6.0,classification
dakshtrehan/Covid-19-Detection,The aim of this project is to help medical practitioners in a practical way to combat the pandemic.,aim medical pandemic practical practitioner combat,0.0,classification
AmitHasanShuvo/Implementations-of-Neural-Network-Algorithms,This repository contains the implementations of different neural network algorithms. The implementation is done without using any library functions. ,library function neural_network,17.0,classification
xaliq2299/UFAZ-BSc,"All programs, codes and projects done during bachelor studies at UFAZ University (2016-2020)",study university bachelor ufaz,22.0,others
J535D165/CoronaWatchNL,"Numbers concerning COVID-19 disease cases in The Netherlands by RIVM, LCPS, NICE, ECML, and Rijksoverheid. ",disease ecml lcp netherland nice rijksoverheid rivm,12.0,classification
rshah240/conv_visualiser,Python Package for Visualising Convolution Neural Network Features and Intermediate Activation.,feature activation neural_network convolution package intermediate visualise,28.0,classification
UdbhavPrasad072300/Transformer-Implementations,"Library - Vanilla, ViT, DeiT, BERT, GPT",library bert vanilla gpt vit deit,25.0,classification
astha77-bot/Machine-Learning-Projects-for-Beginners,My effort to contribute in open source with some Classic Machine Learning Projects to Boost up skills and knowledge if you're a Beginner.,effort classic beginner contribute boost skill knowledge,1.0,prediction
shouhaddo/Python-Training,This is a repository to share my students who are undergoing python training under me codes of everyday lectures provided by me. ,training lecture student share everyday undergo,26.0,classification
ahmedbesbes/cartoonify,Deploy and scale serverless machine learning app - in 4 steps.,machine_learning scale deploy step app serverless,17.0,classification
NorskRegnesentral/weak-supervision-for-NER,Framework to learn Named Entity Recognition models without labelled data using weak supervision.,learn label name_entity recognition framework supervision weak,21.0,classification
zademn/EverythingCrypto,(Still exploring) My cryptography journey: A collection of notebooks covering different algorithms and concepts from cryptography,explore journey a_collection concept cover cryptography,5.0,others
kkoutini/cpjku_dcase20,CP-JKU submission to DCASE 20 ,submission cp dcase jku,25.0,classification
hikmahealth/covid19countymap,Hikma Health COVID-19 US County Policy Dataset,dataset county covid_19 health policy hikma,26.0,classification
LinuxForHealth/java-connect-archived,Linux For Health Connectors for Inbound Data Processing ,processing health connector inbound linux,26.0,classification
gitter-lab/nn4dms,Neural networks for deep mutational scanning data,data neural_network deep scan mutational,4.0,others
gauchm/mts-lstm,Rainfall-Runoff Prediction at Multiple Timescales with a Single Long Short-Term Memory Network,prediction memory short_term multiple single rainfall runoff timescale,3.0,classification
leoll2/MedicalCNN,Abnormality detection in mammogram images using Deep Convolutional Neural Networks,network convolutional_neural image detection deep mammogram abnormality,19.0,classification
kookmin-sw/capstone-2020-2,FBI: Facial expression & brainwave signals based emotion recognition and analysis web service,recognition emotion facial_expression signal web service brainwave fbi,14.0,classification
aub-mind/Arabic-Empathetic-Chatbot,Seq2Seq-based open domain empathetic conversational model for Arabic: Dataset & Model,model seq2seq domain arabic conversational empathetic,4.0,others
emarkou/multilingual-bert-text-classification,text classification using mbert,classification text,21.0,classification
ColeRutledge/indeed_scraper,"a simple data scraping project to power a job search project using Python, Selenium, Pandas, and BeautifulSoup.",power search scrape pandas job beautifulsoup selenium,4.0,others
yaramohajerani/GL_learning,Automated Grounding Line Delineation,automate delineation grounding,12.0,classification
ashwinpn/Movie-Recommendation-Engines,"Writing recommendation systems for movies, and performing data analysis on movie datasets to gain valuable insights.",movie recommendation perform insight gain valuable,6.0,classification
Britefury/django-labeller,"An image labelling tool for creating segmentation data sets, for Django and Flask.",set create segmentation tool flask labelling django,12.0,classification
dataength/automating-your-data-pipeline-with-apache-airflow,Automating Your Data Pipeline with Apache Airflow,automate pipeline airflow apache,5.0,others
selab-hcmus/AI_City_2020,iTASK - Intelligent Traffic Analysis Software Kit,traffic software kit intelligent itask,22.0,others
NAMD/covidash,Dashboard for the corona virus pandemic,dashboard pandemic corona_virus,10.0,classification
cliburn/sta-663-2021,Computational Statistics and Statistical Computing,computational statistical statistic computing,1.0,prediction
Technocolabs100/Stack-Overflow-Tag-Predictions,Tag Prediction from Stack Overflow Questions,prediction stack question tag overflow,3.0,classification
NVIDIA/rapidAligner,Windowed alignment of time series at the speed of light,time_series speed light alignment windowed,9.0,classification
kaburelabs/Wine-Project-Dash,My second web development project using Dash. ,development web dash,2.0,prediction
mhmoodlan/arabic-font-classification,Arabic Font Classification,classification font arabic,26.0,classification
PolyCortex/polydodo,Automatic Sleep Analysis Tool,analysis tool automatic sleep,9.0,classification
timeatlas-dev/timeatlas,A time series data manipulation tool for Python ,data time_series tool manipulation,22.0,others
fukou/bmkg,:zap: Web-based application for predicting flood events using machine learning method in Cilacap Regency,method event web flood zap cilacap regency,28.0,classification
hermanwh/master-thesis,Condition Monitoring of Heat Exchangers using Machine Learning,monitor heat condition exchanger,10.0,classification
berenslab/mini-atlas,Phenotypic variation of transcriptomic cell types in mouse motor cortex,type transcriptomic cell variation mouse cortex motor phenotypic,0.0,classification
KMnP/fashionpedia-api,Python API for Fashionpedia Dataset,dataset api,14.0,classification
NVIDIA/cheminformatics,"Facilitates searching, screening, and organizing large chemical databases",search database screen chemical facilitate organize,6.0,classification
arthursdays/HKBU_HPML_COVID-19,"Source code of paper ""Benchmarking Deep Learning Models and Automated Model Design for COVID-19 Detection with Chest CT Scans"".",model detection automate design covid_19 chest ct_scan benchmarke,12.0,classification
toobaz/mpl_sankey,A matplotlib-based library to produce sankey plots,library plot produce matplotlib sankey,3.0,classification
aravindvarier/Image-Captioning-Pytorch,Hyperparameter analysis for Image Captioning using LSTMs and Transformers,analysis lstms transformer hyperparameter image_caption,28.0,classification
ajshajib/dolphin,Automated pipeline for lens modelling based on lenstronomy.,automate pipeline modelling lens lenstronomy,5.0,others
amiratag/DistributionalShapley,Distributional Shapley: A Distributional Framework for Data Valuation,framework valuation distributional shapley,8.0,classification
AaronWard/covidify,Covidify - corona virus report and dataset generator for python 📈,dataset generator report corona_virus covidify,10.0,classification
letianzj/QuantResearch,"Quantitative analysis, strategies and backtests",strategy analysis quantitative backtest,0.0,classification
mindaffect/pymindaffectBCI,Python SDK for high performance on-line Brain Computer Interface development.,performance brain development interface computer sdk,13.0,classification
lxdv/ecg-classification,ECG Arrhythmia classification using CNN,cnn classification ecg arrhythmia,15.0,classification
sergiocalde94/pydrift,"How do we measure the degradation of a machine learning process? Why does the performance of our predictive models decrease? Maybe it is that a data source has changed (one or more variables) or maybe what changes is the relationship of these variables with the target we want to predict. `pydrift` tries to facilitate this task to the data scientist, performing this kind of checks and somehow measuring that degradation.",measure variable relationship facilitate decrease degradation pydrift,14.0,classification
kaist-dmlab/Hi-COVIDNet,"Codes and data for the paper ""Hi-COVIDNet: Deep Learning Approach to Predict Inbound COVID-19 Patients and Case Study in South Korea"", KDD 2020",study patient korea kdd south inbound covidnet,19.0,classification
community-insight-impact/covid_community_vulnerability,A US county-level COVID-19 vulnerability index,county level covid_19 vulnerability,26.0,classification
attilanagy234/neural-punctuator,Complimentary code for our paper Automatic punctuation restoration with BERT models,bert automatic restoration punctuation complimentary,12.0,classification
JuliaGraphs/VegaGraphs.jl,Create beatiful and interactive visualizations for graphs using Vega-Lite,create visualization graph interactive lite beatiful vega,20.0,others
University-of-Reading-Space-Science/HUXt,HUXt - a lightweight solar wind model.,wind lightweight huxt solar,15.0,classification
simoneSantoni/digital-leadership-center,Code and sample data to reproduce the visualizations included in the Digital Leadership Center website,visualization center reproduce website digital leadership,20.0,others
3springs/deep_ml_curriculum,"Data and Machine Learning Curriculum for Oil, Gas, and Mining",mining gas oil curriculum,24.0,prediction
Copenhagen-Alliance/versification-specification,Versification mappings and versification snifffing,mapping snifffe,4.0,others
mmcdermott/comprehensive_MTL_EHR,Source code for a comprehensive analysis of MTL over EHR timeseries data.,timeserie comprehensive ehr mtl,5.0,others
matchms/ms2deepscore,Deep learning similarity measure for comparing MS/MS spectra with respect to their chemical similarity,similarity measure compare chemical respect spectra,2.0,prediction
iliasprc/COVIDNet,PyTorch implementation of COVID-Net https://github.com/lindawangg/COVID-Net,pytorch covid net,8.0,classification
meteofrance/meteonet,MeteoNet's toolbox and documentation,documentation toolbox meteonet,10.0,classification
Tixierae/OrangeSum,"The French summarization dataset introduced in ""BARThez: a Skilled Pretrained French Sequence-to-Sequence Model"".",sequence summarization pretraine french introduce barthez skilled,24.0,prediction
thenineteen/Semiology-Visualisation-Tool,Data driven 3D brain visualisation of semiology. Semiology to anatomy translator based on over 4600 patients from 309 peer-reviewed articles.,brain review anatomy peer visualisation semiology translator,28.0,classification
phucdkbk/recommendation-tensorflow-2,"Tensorflow 2 implementation for some recommendation algorithms: FISM, NAIS with point-wise and pair-wise loss",recommendation tensorflow_2 wise pair loss fism nais,6.0,classification
spatialthoughts/spatial-data-science,Projects and Examples demonstrating the use of machine learning with geospatial data,data machine_learning demonstrate geospatial,23.0,classification
AlexIoannides/data-science-and-ml-notebook,Data science and machine learning experiments and code snippets,machine_learning data_science experiment snippet,9.0,classification
CUHK-ESSC-4510/ESSC4510-2020-Spring,ESSC4510 Statistical Methods and Data Analysis for Earth System Science,method analysis statistical earth science essc4510,14.0,classification
deepset-ai/COVID-QA,API & Webapp to answer questions about COVID-19. Using NLP (Question Answering) and trusted data sources.,nlp covid_19 question_answer api answer_question trust webapp,12.0,classification
xuhao1/FOXTracker,Facial Head Pose Tracker for Gaming,facial head tracker pose gaming,1.0,prediction
lryz0612/DRL-Energy-Management,Deep reinforcement learning based energy management strategy for hybrid electric vehicle,deep_reinforcement learning strategy management hybrid vehicle energy electric,14.0,classification
fzantalis/colab_collection,A collection of google colab notebooks,a_collection google_colab,4.0,others
SOMJANG/Youtube_Comment_Crawler,"유튜브 댓글 크롤러 ( Python, BeautifulSoup, Selenium )",beautifulsoup selenium,9.0,classification
marco-lancini/cartography-queries,Utilities for programmatic analysis of Cartography data,analysis utility cartography programmatic,2.0,prediction
baladutt/modeling-epidemics-COVID-19,ML on COVID-19 - presentation at MLDS Conference - https://analyticsindiamag.com/using-ml-model-to-fight-covid-19-a-case-study/. Jupyter notebooks using models like SEIR to predict COVID-19 spread,predict spread conference seir covid_19 ml presentation mld,23.0,classification
chandar-lab/Lifelong-Hanabi,A Continual Multi-agent RL testbed based on Hanabi,multi_agent rl continual hanabi testbe,14.0,classification
mariostrbac/environmental-sound-classification,Environmental sound classification with Convolutional neural networks and the UrbanSound8K dataset.,dataset network convolutional_neural sound classification environmental urbansound8k,19.0,classification
sayakpaul/SimSiam-TF,Minimal implementation of SimSiam (https://arxiv.org/abs/2011.10566) in TensorFlow 2.,tensorflow_2 minimal simsiam,24.0,prediction
oscovida/oscovida,Explore COVID19 case numbers and deaths related to Coronavirus outbreak 2019/2020 in Pandas and in Jupyter notebook with MyBinder,explore coronavirus outbreak covid19 pandas death mybinder,3.0,classification
ChevronETC/Examples,"Examples using COFII, the Chevron Optimization Framework for Imaging and Inversion.",optimization imaging framework inversion chevron cofii,24.0,prediction
tsdataclinic/scout,An tool to enable people to more easily explore open data provided by NYC,explore tool people enable easily nyc,22.0,others
robert-lieck/pitchscapes,Python library to compute pitch scapes for music analysis.,library analysis music compute pitch scape,2.0,prediction
pc4covid19/COVID19,Rapid prototyping coalition for SARS-CoV-2 tissue infection dynamics. (integrated model),dynamic infection integrate sar_cov rapid prototype tissue coalition,24.0,prediction
SAP-samples/teched2020-INT260,INT260 - Data Classification with Python SDK and SAP AI Business,ai classification business sdk int260 sap,9.0,classification
mcoughlin/ast8581_2021_Spring,"Github repository for ""Big Data in Astrophysics"" - Spring 2021",spring big_data astrophysic,26.0,classification
qistudio/ifn619,IFN619 - Data Analytics for Strategic Decision Makers,analytic decision maker strategic ifn619,14.0,classification
yandex-research/navigan,Navigating the GAN Parameter Space for Semantic Image Editing,edit parameter gan semantic space navigate,1.0,prediction
FlorianMarquardt/machine-learning-for-physicists,"Code for ""Machine Learning for Physicists 2020"" lecture series",machine_learning series lecture physicist,6.0,classification
nbertagnolli/counsel-chat,This repository holds the code for working with data from counselchat.com,data hold counselchat,4.0,others
alshedivat/fedpa,Federated posterior averaging implemented in JAX,federate jax posterior averaging,19.0,classification
faithfulalabi/Zillow_Scraper,Repo for Zillow Web scraper,web scraper zillow,25.0,classification
makispl/Spotify-Data-Analysis,Fetching & Statistical Analysis of Spotify Data,data analysis spotify statistical fetch,14.0,classification
fissoreg/relative-gradient-jacobian,Relative gradient optimization of the Jacobian term in unsupervised deep learning.,term optimization gradient relative unsupervise jacobian,28.0,classification
mlaves/well-calibrated-regression-uncertainty,"Code for our MIDL2020 submission ""Well-Calibrated Regression Uncertainty in Medical Imaging with Deep Learning"".",regression submission imaging medical uncertainty calibrate midl2020,24.0,prediction
i13abe/Triplet-Loss-for-Knowledge-Distillation,Triplet Loss for Knowledge Distillation,triplet_loss knowledge_distillation,1.0,prediction
Exusai/SuperResolutionWaifuNN,"I wanted to build my own implementation of waifu2x using Keras and TensorFlow, but I ended up using a slightly different architecture.",architecture build kera_tensorflow waifu2x,15.0,classification
virtualritz/nsi,High level Rust bindings for Illumination Research’s Nodal Scene Interface – ɴsɪ.,research level interface scene binding illumination nodal rust,0.0,classification
alighandij/ReinforcementLearning,RL algorithms from basic one to state-of-the-art,state_art rl,9.0,classification
vijishmadhavan/ArtLine,A Deep Learning based project for creating line art portraits.,deep_learning create portrait art,17.0,classification
GoogleCloudPlatform/ml-design-patterns,Source code accompanying O'Reilly book: Machine Learning Design Patterns,machine_learning design pattern accompany book o_reilly,6.0,classification
phuselab/pyVHR,Python framework for Virtual Heart Rate,rate heart framework virtual,3.0,classification
Geeksongs/Computer_Vision,"This repository includes the code of Computer Vision, such as Object Detection,   Semantic segmentation，Pedestrian re-identification and so on.The code is implemented in Tensorflow2.0+ and Pytorch.If you like it, Please give me a star,thanks!",identification object_detection computer_vision semantic_segmentation star tensorflow2 pedestrian,1.0,prediction
Road-Balance/SpotMicroJetson,Let's make SpotMicro with Nvidia Jetson Nano.,nvidia jetson_nano spotmicro,3.0,classification
jreades/sds_env,Spatial Data Science Environment,environment data_science spatial,0.0,classification
brazil-data-cube/code-gallery,A gallery of interesting Jupyter Notebooks based on Brazil Data Cube data and technologies,data technology brazil gallery cube,25.0,classification
SAP-samples/teched2020-DAT263,DAT263 - Create and Manage End-to-End Data Pipelines with SAP Data Intelligence,data create pipeline end_end manage intelligence sap dat263,5.0,others
Biuni/coronavirus-marche,📈 CSV and JSON data about COVID-19 emergency in the Marche region (Italy),csv italy emergency json region marche,2.0,prediction
CODAIT/covid-notebooks,Jupyter notebooks that analyze COVID-19 time series data,data analyze time_series covid_19,12.0,classification
mit-gfx/ContinuousParetoMTL,"[ICML 2020] PyTorch Code for ""Efficient Continuous Pareto Exploration in Multi-Task Learning""",learning exploration multi task efficient continuous icml_2020 pareto,6.0,classification
deepchem/moleculenet,Moleculenet.ai Datasets And Splits,dataset ai split moleculenet,27.0,prediction
anthonyli358/spotify-recommender-systems,Exploration implementing recommender systems using Spotify data.,data spotify recommender exploration,6.0,classification
wangjinzhulala/North_China_Plain_GEE_Organized,The built-up land mapping of the North China Plain from 1990 to 2019,build land china mapping north plain,4.0,others
3D-Wizard/3D-Wizard-World,Resources of 3D Wizard Projects,3d resource wizard,5.0,others
MelLain/mipt-python,Python lectures and tasks for MIPT/MSU/MAI students (in russian),lecture task student russian mai mipt msu,26.0,classification
bmild/nerf,Code release for NeRF (Neural Radiance Fields),neural release field radiance nerf,17.0,classification
kunalj101/Data-Science-Hacks,"Data Science Hacks consists of tips, tricks to help you become a better data scientist. Data science hacks are for all - beginner to advanced. Data science hacks consist of python, jupyter notebook, pandas hacks and so on. ",data_science trick,4.0,others
dexplo/jupyter_to_medium,Python package for publishing Jupyter Notebooks as Medium blogposts,package publish_medium blogpost,17.0,classification
matthewearl/q1physrl,Quake 1 movement physics reinforcement learning,reinforcement_learning physics movement quake,28.0,classification
GDSL-UL/san,Spatial Analysis Notes,analysis note spatial,0.0,classification
microprediction/microprediction,Client for Microprediction.Org,client microprediction,15.0,classification
cvlab-stonybrook/SID,"Official implementation for ICCV19 ""Shadow Removal via Shadow Image Decomposition"" ",removal decomposition iccv19 shadow,8.0,classification
parthpatwa/covid19-fake-news-detection,Official repository for data set and baselines for covid19 fake news data. ,data set fake_news covid19 baseline,5.0,others
ihmeuw/covid-model-deaths,The IHME Covid-19 Statistical deaths model,statistical covid_19 death ihme,14.0,classification
joedockrill/jmd_imagescraper,Image scraping library for creating deep learning datasets,library dataset deep_learning create image scrape,21.0,classification
liamca/covid19search,Covid-19 Search App,search covid_19 app,19.0,classification
soumik12345/DDPG,Pytorch implementation of the Deep Deterministic Policy Gradients for Continuous Control,control pytorch deep gradient continuous policy deterministic,8.0,classification
snooty7/BrawlStars,Convolutional Neural Network Playing Brawl Stars,network convolutional_neural play star brawl,19.0,classification
DanilBaibak/movie-recommendation-system,Building recommendation system based Bayesian Personalized Ranking using TensorFlow 2.1,recommendation tensorflow_2 build rank bayesian personalize,27.0,prediction
vaithak/Sudoku-Image-Solver,A tool for solving sudoku puzzles with computer vision.,tool computer_vision solve puzzle sudoku,20.0,others
ShubhikaBhardwaj/Machine-Learning-Algorithm,"Implementation of Regression, KNN , Clustering, Neural Networks etc.",neural_network regression clustering knn,24.0,prediction
Cryptolytic-app/cryptolyticapp,Predicting Arbitrage in the Crypto Market with Machine Learning,predict machine_learning market crypto arbitrage,5.0,others
akuhren/selective_gp,Code accompanying the paper Probabilistic Selection of Pseudo-Points for Sparse Gaussian Processes.,accompany selection probabilistic sparse gaussian_process pseudo,20.0,others
armkhudinyan/sar_ship_detect,Ship detection on radar images using Keras,image detection kera ship radar,21.0,classification
researchmm/STTN,[ECCV'2020] STTN: Learning Joint Spatial-Temporal Transformations for Video Inpainting,video transformation spatial joint inpainte temporal eccv_2020 sttn,10.0,classification
FrancescoSaverioZuppichini/glasses,High-quality Neural Networks for Computer Vision 😎,neural_network quality computer_vision,23.0,classification
