full_name,description,filtered,top_topic,domain
DEBBY-CODE/ATTRITION-CONTROL-CASE-STUDY-TAKENMIND-GLOBAL-DATA-ANALYTICS-INTERNSHIP,The data is for company X which is trying to control attrition. Objective What type of employees are leaving? Predict/Determine which employees are prone to leave next. ,attrition company determine employee leave objective prone,0.0,classification
csaid/Illusion,Code for an animated sinusoidal Müller-Lyer illusion,animate illusion ller lyer sinusoidal,9.0,classification
egipcy/LIRD,Deep Reinforcement Learning for Movies Recommendation System,deep_reinforcement learning movie recommendation,6.0,classification
sunggukcha/xor,xor activation,activation xor,28.0,classification
Apress/learn-tensorflow-2,Source Code for 'Learn TensorFlow 2.0' by Pramod Singh and Avinash Manure,avinash manure pramod singh tensorflow_2,23.0,classification
jediofgever/PointNet_Custom_Object_Detection,"A project that show cases, train and testing of PointNet with custom objects/datasets",dataset custom object pointnet train,23.0,classification
LeonidMurashov/advantage-actor-critic-gae,"This repository contains implementation of A2C with GAE, which is used to control robot in MuJoCo environment.",control a2c environment gae mujoco robot,20.0,others
AIAFammy/Side-Window-Filtering-Python,"Python implementation of CVPR 2019 Oral paper ""Side Window Filtering""",paper cvpr filtering oral window,18.0,others
viscio/Battery-RUL-predictions,Prediction of battery lifetimes based on a Recurrent Neural Network (RNN) architecture. Data publicly available here: https://doi.org/10.1038/s41560-019-0356-8,architecture battery lifetime prediction publicly recurrent_neural rnn,1.0,prediction
edenau/monopoly-monte-carlo,🎩 A Monte Carlo simulation of Monopoly board game,monte_carlo simulation board game monopoly,12.0,classification
bnwebcode/pytorch-detach,A very short demo of the detach function in pytorch,demo detach function pytorch short,20.0,others
Apress/hands-on-scikit-learn-for-mach-learning-apps,Source code for 'Hands-on Scikit-Learn for Machine Learning Applications' by David Paper,paper david hand machine_learning scikit_learn,6.0,classification
ayyucekizrak/EfficientNet-Transfer-Learning-Implementation,EfficientNet: Rethinking Model Scaling for Convolutional Neural Networks,network convolutional_neural efficientnet rethink scale,10.0,classification
7vvXi/writeEnglish,Generate English sentences close to summaries using LexRank algorithm and singleLSTM.,close english generate lexrank sentence singlelstm summary,13.0,classification
Artash-N/Ariel-Machine-Learning-Training-Module-for-Exoplanets,Create your Machine Learning Neural Network to reduce the noise in exoplanet observations. (Ariel Telescope Data Simulation),simulation observation reduce ariel exoplanet noise telescope,8.0,classification
CNIC92/beat-the-stock-market,Is it possible to find which stocks will perform well in the future by looking at past financial data?,data perform financial future stock,13.0,classification
aishwarya-pawar/Instagram-Posts-Engagement-Analysis-Natural-Language-Processing,Engagement analysis of the Instagram posts for National Geography using image labels and captions,caption engagement geography instagram label national post,15.0,classification
dhminh1024/htr_vietnamese,Building CRNN model to recognize vietnamese handwritten text. Data from Cinamon AI Marathon 2018,ai build cinamon crnn handwritten_text marathon recognize vietnamese,27.0,prediction
siddgood/podcast-recommendation-engine,:microphone: Building a content-based podcast recommender system using NLP ,build content microphone nlp podcast recommender,6.0,classification
aparrish/comexmadivla,Computational exploration of magical and divinatory language,computational divinatory exploration language magical,19.0,classification
nwams/ClinicalBERT-Deep-Learning--Predicting-Hospital-Readmission-Using-Transformer,Blog post on Medium,blog_post medium,9.0,classification
FavioVazquez/improve-writing,Using textstat to write better blogs and improve readability.,blog readability textstat,23.0,classification
ivailop7/Spotify-Music-Analysis,Personal Spotify Music Trend Analysis,analysis spotify music personal trend,6.0,classification
shravan-kuchkula/Data-Pipeline-Batch-ETL-with-Airflow,"A production-grade data pipeline has been designed to automate the parsing of user search patterns to analyze user engagement.  Extract data from S3, apply a series of transformations and load into S3 and Redshift.",engagement grade load parsing redshift s3 transformation user,6.0,classification
networktocode/netbox-training,Examples and demos from Network to Code's NetBox training,network demos netbox training,1.0,prediction
Dhanachandra/bert_crf,BERT CRF model for Name Entity Recognition in pytorch,pytorch bert crf name_entity recognition,21.0,classification
yuyasugano/terraform-sagemaker-sample-1,a sample repository for terraform to run Amazon SageMaker notebook part 1,amazon_sagemaker run terraform,22.0,others
midas-wyss/sweettalk,Deep learning-based language model for glycan sequences,deep_learning language glycan sequence,10.0,classification
amitbcp/icdmai_2020,"This repository is for the Session held in International Conference on Data Management, Analytics and Innovation, New Delhi 2020",management analytic conference delhi hold innovation international session,27.0,prediction
snnclsr/visualize_optimizers,Visualization of DL optimization algorithms,dl optimization visualization,6.0,classification
henry32144/pggan-tensorflow,A TF 2.0 implementation of Progressive growing of GANs,2_0 gan grow progressive,1.0,prediction
SiegfriedZhen/taiwan-2020-election,get Taiwan 2020 votes of political party with township and county,county party political taiwan township vote,26.0,classification
jwkanggist/EverybodyTensorflow2.0,EverybodyTensorflow with tf2.x,everybodytensorflow tf2,28.0,classification
xtinkt/editable,"A supplementary code for Editable Neural Networks, an ICLR 2020 submission.",neural_network editable iclr submission supplementary,25.0,classification
inducer/2020-geilo-gpu-python,Notebooks for lectures on abstractions for GPU programming at the 2020 Geilo winter school,abstraction geilo gpu lecture programming school winter,26.0,classification
math-econ-code/mec_optim_2020-01,'math+econ+code' masterclass on optimal transport and economic applications,econ economic masterclass math optimal_transport,25.0,classification
Cortexelus/qubit-audio-synthesis,"Generating audio from qubits, using Qiskit.",audio generate qiskit qubit,21.0,classification
Abdel-Razzak/DataScience,Learning Journey: Data Science,learn data_science journey,6.0,classification
raffg/multi_armed_bandit,Monte Carlo simulations of several different multi-armed bandit algorithms and a comparison with classical statistical A/B testing,monte_carlo simulation comparison armed bandit classical multi statistical,12.0,classification
tlkh/depsep-conv-benchmarks,Code for Depth-wise Separable Convolutions: Performance Investigations,convolution depth investigation performance separable wise,10.0,classification
Matuzas77/MNIST-0.17,MNIST classifier with average 0.17%  error,average classifier error mnist,12.0,classification
duennbart/masterthesis_VAE,"VAE, Variational Autoencoder, Deep Learning, Medical Imaging",deep_learning imaging medical vae variational_autoencoder,24.0,prediction
yiskw713/ScoreCAM,the re-implementation of Score CAM with pytorch,pytorch cam score,18.0,others
gpt2ent/stylegan-explorer,StyleGAN Explorer in Colab + JS GUI,colab explorer gui js stylegan,4.0,others
sydeaka/neural_networks_longitudinal,Demo use of Neural Networks for Longitudinal Data Analysis,data analysis demo neural_network longitudinal,2.0,prediction
rajat5ranjan/AV-LTFS-Data-Science-FinHack-2,LTFS Data Science FinHack 2 organised by AV,data_science av finhack ltfs organise,4.0,others
vincekellner/demandforecasting,Forecast taxi demand for given areas in New York City,city demand forecast taxi york,12.0,classification
daitan-innovation/cnn-audio-mos-estimator,Using Deep Learning to predict audio quality. ,predict audio deep_learning quality,23.0,classification
NanoNets/bert-text-moderation,BERT + CNN for toxic comments multi label classification. ,cnn bert classification comment multi_label toxic,9.0,classification
tanishqgautam/Neural-Networks-in-Pytorch,"Logistic Regression, ANN, CNN and RNN implemented using Pytorch",rnn pytorch cnn ann logistic_regression,9.0,classification
tanishqgautam/Multi-Label-Segmentation-With-FastAI,Multi Label Segmentation using U-NET with FastAI Implementation,multi_label fastai segmentation u_net,24.0,prediction
vardhaman-datascience/lung_cancer_detection, Classification of images based on the tumors present in the lungs ,image classification lung tumor,9.0,classification
madlag/medium_posts,Accompanying code for Medium posts from https://medium.com/@francois.lagunas,post medium accompany,18.0,others
vicgalle/sgmcmc-force,"Samplers from the paper ""Stochastic Gradient MCMC with Repulsive Forces""",force gradient mcmc repulsive sampler stochastic,12.0,classification
joehoeller/Object-Detection-on-Thermal-Images,Robust Object Classification of Occluded Objects in Forward Looking Infrared (FLIR) Cameras,object classification camera flir infrare occlude robust,9.0,classification
pdtyreus/coronavirus-ds,Jupyter notebooks and python scripts for investigating the 2019 coronavirus outbreak,investigate coronavirus outbreak,3.0,classification
ucuapps/CoronaryArteryStenosisScoreClassification,CNN for Classification of Coronary Artery Stenosis Score inMPR Images. ,cnn classification score artery coronary inmpr stenosis,18.0,others
sedflix/unsacmt,Unsupervised Sentiment Analysis for Code-mixed Data,data mix sentiment_analysis unsupervised,25.0,classification
willshiao/YerFont,🖊️ Converts handwriting into a installable font and allows interleaving of different handwritten fonts. Won Best Entrepreneurial Hack at HackUCI 2020!,entrepreneurial font hack hackuci handwrite handwritten installable interleave,13.0,classification
bigvideoresearch/OIM,Object Instance Mining for Weakly Supervised Object Detection (AAAI 2020),object aaai instance mining object_detection supervised weakly,1.0,prediction
jkwieser/personality-detection-text,Predicting big five personality traits from a given text.,predict text big personality trait,17.0,classification
Manuscrit/Area-Under-the-Margin-Ranking,Implementation of the paper Identifying Mislabeled Data using the Area Under the Margin Ranking: https://arxiv.org/pdf/2001.10528v2.pdf,identify margin mislabele rank,0.0,classification
odaxiom/gdpr-censor,A python package that aims to anonymize string,aim anonymize package string,0.0,classification
kevin-meng/financial_stock_knowledge_graph,base on chinese stock market data,data chinese stock_market,27.0,prediction
ismms-himc/visium-clustergrammer2,Spatial Transcriptomics Dashboard,dashboard spatial transcriptomic,0.0,classification
ZackAkil/deep-tic-tac-toe,Used deep reinforcement learning to train a deep neural network to play tic-tac-toe and deployed using tensorflow.js.,deep_reinforcement js deploy play tac tic toe,14.0,classification
tavishcode/linkedin_analysis,Visualizing My LinkedIn Network using Tree Maps,network linkedin map tree visualize,10.0,classification
unit8co/medium-tsp,"Appendix repository for Medium article ""Routing Traveling Salesmen on Random Graphs using Reinforcement Learning, in PyTorch""",appendix graph medium_article random reinforcement_learning route salesman travel,20.0,others
chestnut111/3D-unet-keras-Brats2019,3D Unet biomedical segmentation model for BraTS2019,segmentation 3d biomedical brats2019 unet,12.0,classification
facundodeza/transfomer-audio-classification,small experimentation about positional encoding,encoding experimentation positional,15.0,classification
Kanghee-Lee/Mask-RCNN_TF,Tensorflow implementation of the Mask R-CNN network proposed in 'Mask R-CNN' paper by Facebook AI Research,cnn tensorflow facebook mask_r propose research,14.0,classification
german-asr/nvidia-jasper-german,Scripts for training NVIDIA Jasper for German Speech Recognition (ASR).,training asr german jasper nvidia speech_recognition,3.0,classification
mattsherar/Temporal_Fusion_Transform,Pytorch Implementation of Google's TFT,pytorch google,13.0,classification
ImperialCollegeLondon/Computer_Vision_2020,"CO315: Computer Vision, Spring Term, 2019 - 2020",term co315 computer_vision spring,28.0,classification
ermongroup/smile-mi-estimator,"PyTorch implementation for the ICLR 2020 paper ""Understanding the Limitations of Variational Mutual Information Estimators""",iclr 2020_paper estimator limitation mutual_information variational,8.0,classification
huyng/incertae,Code for MC Dropout and Model Ensembling Uncertainty Estimate experiments,dropout ensemble estimate experiment uncertainty,3.0,classification
huddyyeo/soft_attention_LSTM_time_series_forecasting,soft attention mechanism with lstm neural networks,neural_network lstm attention mechanism soft,17.0,classification
aljabr0/degraph,Evolving graph plotting with differentiable programming on Tensorflow 2,tensorflow_2 plot programming graph differentiable evolve,27.0,prediction
AmandaZou/master-machine-learning-algorithms,This is a repository for notes and codes of reading the book --- Jason Brownlee Master Machine Learning Algorithms,note book brownlee jason master read,15.0,classification
vafaei-ar/TeIAS-2020,Tehran Institute for Advanced Studies - Data Science Winter School - 2020,school winter data_science advanced institute study tehran,23.0,classification
JacksonWuxs/19nCoV-SEIR-Estimation,An adjustive SEIR model to estimate parameters of 2019-nCoV,parameter estimate adjustive ncov seir,23.0,classification
MIT-LCP/sccm-datathon,Resources for the Society of Critical Care Medicine (SCCM) Datathon,critical care datathon medicine resource sccm society,5.0,others
sivaji1233/09_turbofan_rul,Remaining useful life prediction for turbofan engine data (C-MAPSS),prediction engine life mapss remain turbofan,3.0,classification
sayakpaul/Emotion-Detection-using-Deep-Learning,"This project demonstrates the use of Deep Learning to detect emotion (sad, angry, happy etc) from the images of  faces. ",emotion face detect angry demonstrate happy sad,23.0,classification
frank0532/Bayesian_Neural_Networks,implement bayesian neural networks on tensorflow.,neural_network tensorflow bayesian,5.0,others
PierreGtch/AMAL-project,"Comparaison of adversarial training algorithms (FreeLB, FreeAT and K-PGD) on natural language tasks",training adversarial comparaison freeat freelb natural_language pgd task,8.0,classification
xixi0222/Quantitative-Analysis-of-Fundamentals-by-Machine-Learning,Quantitative analysis of fundamentals in quarterly reports by Machine Learning,analysis fundamental quantitative quarterly report,2.0,prediction
biharicoder/medium_blogs,For providing code link to blogs on medium,medium blog link,23.0,classification
zsef123/PointRend-PyTorch,A PyTorch implementation of PointRend: Image Segmentation as Rendering,pytorch image segmentation pointrend render,13.0,classification
yuanhunglo/pair,Pair: image-based product collection recommender,image recommender product collection pair,23.0,classification
fescobar96/Video-Background-Removal,Extraction and removal of a video background using k-means.,video background extraction removal,8.0,classification
dnhkng/AIoT,Cutting-Edge Artificial Intelligence on the Jetson Nano used to decode Brain Waves (EEG) on the Edge,artificial_intelligence brain cut decode edge eeg jetson_nano wave,0.0,classification
daniel-rychlewski/hsi-toolbox,Hyperspectral CNN compression and band selection,cnn band compression hyperspectral selection,15.0,classification
dhanushkamath/VariationalAutoencoder,An IPython notebook explaining the concepts of Variational Autoencoders and building one using Keras to generate new faces.,generate variational_autoencoder kera explain face building concept ipython,2.0,prediction
nbshare/awesome-notebooks-ready-to-run,A collection of AI-centered notebooks with links to run.,ai run a_collection link center,1.0,prediction
bridgejio/2019_nCov_predcition,This is a refined mathematical model of the outbreak of 2019-nCov and prediction,prediction outbreak ncov mathematical refined,26.0,classification
karanm14/data_analysis,Notebooks on some of the past data analysis and data science projects I've done,data analysis data_science,4.0,others
r0zetta/meta_embedding_clustering,Clustering of tweets based on textual content using meta embeddings and community detection,detection content clustering community embedding meta textual tweet,6.0,classification
shaoanlu/COVID-19-SINDY,Use SINDY algorithm to discover a dynamical system from coronavirus data,coronavirus discover dynamical sindy,3.0,classification
mikemikezhu/federated-learning-facial-expression-recognition,I try to use federated learning to re-design the computer vision model to make facial expression prediction,learn prediction design computer_vision facial_expression federate,14.0,classification
kathrinv/what-do-you-mean,Using Natural Language Processing (NLP) to analyze Federal Reserve (Fed) Speeches,analyze natural_language federal feed processing_nlp reserve speech,25.0,classification
RnR-2018/BMEN4460-NB1-simple_cell_segmentation_with_a_single_layered_perceptron,Child repository of Deep-learning-with-PyTorch-and-GCP,pytorch deep_learning child gcp,28.0,classification
prakhar21/Writing-with-BERT,Using BERT for doing the task of Conditional Natural Language Generation by fine-tuning pre-trained BERT on custom dataset.,conditional custom bert natural_language task fine_tune generation pre_train,18.0,others
notebookexplore/NotebookExplore,"A collection of #MachineLearning #Python Notebooks 🤖 🐍📚 that can be launched to the ☁️ for use and experimentation.  No setup needed, just launch it 🚀",a_collection experimentation launch machinelearne setup,1.0,prediction
maelfabien/VoiceGenderDetection,A pre-trained MFCC+GMM voice gender detection deployed on Streamlit,deploy gender gmm mfcc pre_trained streamlit voice,13.0,classification
yasersakkaf/Visualize-Women-Harrasment-in-India-using-GeoPandas,An implementation of the GeoPandas library to visualize Women Harrasment in each state and each district of India.,visualize district geopanda harrasment india state woman,5.0,others
VLL-HD/analyzing_inverse_problems,"Code for the paper ""Analyzing inverse problems with invertible neural networks."" (2018)",analyze paper problem neural_network inverse invertible,20.0,others
Blue-Universe/Time-Series-Analysis-Statistical-Arbitrage,This project used GARCH type models to estimate volatility and used delta hedging method to make a profit.,type method garch estimate delta hedging profit volatility,0.0,classification
dair-ai/data_science_writing_primer,Writing Primer for Data Scientists,data_scientist primer,27.0,prediction
amir-Nau/Audio-Classification,This project will use various machine learning algorithms to classify audio,audio machine_learning classify,23.0,classification
PurdueMINDS/Equivalence,Equivalence Between Structural Representations and Positional Node Embeddings,positional embedding equivalence node representation structural,5.0,others
shiivangii/SpotFake,This repository contains the code for the paper titled: SpotFake: A multimodal framework for fake news detection,detection fake_news framework multimodal spotfake title,14.0,classification
RnR-2018/BMEN4460-NB3-brain_tumor_segmentation,Child repository of Deep-learning-with-PyTorch-and-GCP,pytorch deep_learning child gcp,28.0,classification
aydinnyunus/Rock-Paper-Scissors-OpenCV,Rock Paper Scissors with OpenCV and Neural Networks,paper neural_network opencv rock scissor,28.0,classification
skorani/tokenizer,An open source High level Persian Tokenizer ,level persian tokenizer,19.0,classification
lqdev/DeepLearningFromScratchFs,Code from Deep Learning From Scratch Book in F#,deep_learning book scratch,23.0,classification
AI-secure/KNN-PVLDB,"Official Repo for ""Efficient task-specific data valuation for nearest neighbor algorithms""",task efficient neighbor specific valuation,2.0,prediction
adibhandari/Honk4Honda,Predict markets favorable for Honda to expand to,predict expand favorable honda market,5.0,others
YiranJing/Coronavirus-Epidemic-COVID-19,👩🏻‍⚕️Covid-19 estimation and forecast using statistical model; 新型冠状病毒肺炎统计模型预测 (Jan 2020),statistical estimation forecast covid_19 jan,12.0,classification
sumitrj/iPower,Power Usage Prediction for Load Switching,power prediction load switch usage,28.0,classification
AntonMu/Census2020,Visualizing 230 years of US Census data,data visualize census,20.0,others
talha1503/word2vec,Word2Vec implementation(skip-gram model) using numpy and nltk.,gram nltk numpy skip word2vec,4.0,others
sucongCJS/2019_nCov,"some models including SEIR, Logistic, ACM",seir acm logistic,23.0,classification
ethanluoyc/dhmc-jax,Discontinuous Hamiltonian Monte Carlo in JAX,monte_carlo discontinuous hamiltonian jax,12.0,classification
dlwhittenbury/MySQL_IMDb_Project,In this project we will build a MySQL database using the Internet Movie Database (IMDb) dataset.,movie build database imdb internet mysql,6.0,classification
robertosannazzaro/person-removal-detectron2,A repository to host code for a live person removal using OpenCV and Detectron2,removal opencv detectron2 host live person,9.0,classification
tanishqgautam/Instance-Segmentation-using-Mask-R-CNN,Mask R-CNN Instance Segmentation,cnn mask_r instance_segmentation,14.0,classification
Mason0629/RobustLog,Robust Log-Based Anomaly Detection on Unstable Log Data,anomaly_detection robust log unstable,0.0,classification
DS4Earth/sp2020,Data Science for Earth spring 2020,data_science earth spring_2020,4.0,others
ksalama/tfx-workshop,Machine Learning with TensorFlow Extended (TFX) Pipelines,machine_learning pipeline tensorflow extend tfx,5.0,others
lukefeilberg/onion,"Dataset of The Onion articles and real ""Onion-like"" news articles from the subreddit r/NotTheOnion, along with a jupyter notebook extracting the dataset and performing classification.",dataset real news_article nottheonion onion subreddit,21.0,classification
mdoege/PySynth,Python 2/3 music synthesizer scripts (old but still functional project),music functional synthesizer,5.0,others
tomytjandra/text-mining-corona-articles,Text Mining for Indonesian Online News Articles About Corona,text mining news_article corona indonesian online,24.0,prediction
TheMrGhostman/InceptionTime-Pytorch,Unofficial Pytorch implementation of Inception layer for time series classification and its possible transposition for further use in Variational AutoEncoder,time_series classification variational_autoencoder inception layer transposition,9.0,classification
Qottmann/phase-discovery-anomaly-detection,Unsupervised phase discovery via anomaly detection using deep neural networks,neural_network anomaly_detection deep unsupervised discovery phase,21.0,classification
Deepest-Project/FastSpeech,"Implementation of ""FastSpeech: Fast, Robust and Controllable Text to Speech""",robust controllable fast fastspeech text_speech,9.0,classification
david-wb/gaze-estimation,A deep learning based gaze estimation framework implemented with PyTorch,pytorch deep_learning estimation framework gaze,10.0,classification
pietz/simclr,Unofficial PyTorch implementation of SimCLR by Chen et al.,pytorch chen simclr,14.0,classification
madhav727/abstractive-news-summary,Seq2Seq with LSTM keras and attention layer,lstm kera attention layer seq2seq,21.0,classification
zabir-nabil/dot-res-lstm,Classification of ECG signals by dot Residual LSTM Network for anomaly detection,lstm classification anomaly_detection dot ecg residual signal,21.0,classification
dhuynh95/fast_neptune,NeptuneML wrapper to quickly record data about experiments,experiment neptuneml record wrapper,10.0,classification
jaycode/short_sale_volume,Effect of short interest to stock pricing. Uses data from Quandl and stock tickers from NASDAQ,short stock pricing nasdaq quandl ticker,13.0,classification
Landstein/Product-Named-Entity-Recognition,Train a model to find the names of products in text,model train product text name,23.0,classification
boada/inspectorAI,repo holding my insight project,hold insight,4.0,others
dodafin/fincl,Advancing in Financial Machine Learning,machine_learning financial advance,2.0,prediction
11tegen11/AlphaPose-Player-Tracking,Football player tracking using AlphaPose,alphapose football player track,3.0,classification
AidanRocke/AutoDiff,Automatic Differentiation via Contour Integration,automatic contour differentiation integration,9.0,classification
sidgarimella/conveyor,A set of tools to accelerate work in Jupyter notebooks.,set tool accelerate,12.0,classification
RnR-2018/BMEN4460-NB2-image_classification_on_MNIST_data,Child repository of Deep-learning-with-PyTorch-and-GCP,pytorch deep_learning child gcp,28.0,classification
automl/LCBench,A learning curve benchmark on OpenML data,curve learn benchmark openml,4.0,others
praritagarwal/Visualizing-CNN-Layers,Project to visualize the kernels and the outputs of the individual layers of a CNN built in pytorch.,pytorch cnn build kernel visualize layer individual output,9.0,classification
jscriptcoder/Upside-Down-Reinforcement-Learning,Landing a Spaceship using Upside-Down Reinforcement Learning (a.k.a ⅂ꓤ),learn land reinforcement spaceship upside,14.0,classification
ileanabuhan/Tutorial-on-entropies,"An interactive notebook for understanding the relation between mutual information, perceived and hypothetical information ",information mutual_information hypothetical interactive perceive relation understanding,19.0,classification
sayedmohamedscu/Zindi_colab,Download Zindi's compositions datasets directly to google colab ,dataset composition download google_colab zindi,4.0,others
