full_name,description,filtered,top_topic,domain
Akhilesh64/Android-Malware-Detection,Detection of Android Malware based on system calls using Support Vector Machines.,call detection support machine vector android malware,8.0,classification
Abhayparashar31/feature-engineering,A Collection of Useful Notebooks to help in Feature Engineering.,feature a_collection engineering,19.0,classification
jessp/goodwill-trends,Website showing trends in women's tops sold on the Goodwill website.,trend woman website sell goodwill,6.0,classification
himkt/optuna-allennlp,🚀 A demonstration of hyperparameter optimization using Optuna for models implemented with AllenNLP.,demonstration hyperparameter_optimization allennlp optuna,1.0,prediction
Harkishan-99/Alternative-Bars,Generate various Alternative Bars both historically and at real-time.,generate real_time bar alternative historically,28.0,classification
zeglam/Countries-GDP-prediction,Developed a supervised machine learning system that can estimate a country's GDP per capita using regression algorithms. ,develop regression supervised estimate country capita gdp,24.0,prediction
opeyemibami/NLP-Tennis-Bot,A Conversational chatbot built with NLTK and Tensorflow on tennis corpus,build tensorflow nltk chatbot corpus conversational tennis,6.0,classification
Prathyusha-Guduru/Computer-Vision-Projects,Fun projects built using openCV and dlib with Python. 🤘🤞🤙. ,build opencv dlib fun,28.0,classification
HwangToeMat/FaceRecognition_FlaskServer,FaceRecognition FlaskServer for Education Platform,platform education facerecognition flaskserver,12.0,classification
programacaodinamica/dicas-pandas,assets from pandas tips videos,video panda asset,5.0,others
tclarke/sky130radio,components and examples for creating radio ICs using the open skywater 130nm PDK,component radio ic nm pdk skywater,2.0,prediction
MichaelAllen1966/learninghospital,Combining Deep RL and SimPy models of hospital systems,combine deep hospital rl simpy,14.0,classification
LiamMaclean216/Pytorch-Transfomer,My implementation of the transformer architecture from the Attention is All you need paper applied to time series.,paper time_series architecture apply attention transformer,6.0,classification
yuhuixu1993/BNET,Batch Normalization with Enhanced Linear Transformation,transformation enhance normalization linear batch,10.0,classification
saeed1262/MoVi-Toolbox,"Data Preparation, Processing, and Visualization for MoVi Data ",data visualization processing preparation movi,13.0,classification
shie-ld/fideo,Project to convert any file to video file.,video convert,5.0,others
amruthraghav/FINA4350,Group Project Work of Text Analytics and Natural Language Processing in Finance and Fintech,analytic text natural_language processing finance group fintech,13.0,classification
damonjw/datasci,Modelling and machine learning: the foundations of data science,model machine_learning data_science foundation,19.0,classification
epic-kitchens/epic-kitchens-100-object-masks,:wine_glass: Support library for the MaskRCNN masks extracted on EPIC-KITCHENS-100,extract support mask wine glass epic kitchens maskrcnn,0.0,classification
brihijoshi/granular-similarity-COLING-2020,"Code for the paper ""The Devil is in the Details: Evaluating Limitations of Transformer-based Methods for Granular Tasks"" accepted at COLING 2020",evaluate limitation task transformer accept cole devil granular,23.0,classification
fastai/fastlinkcheck,Check local static links and online links fast and in parallel,link online fast check local parallel static,1.0,prediction
mpicbg-csbd/phasenet,Fast and accurate aberration estimation from 3D bead images using convolutional neural networks,convolutional_neural estimation 3d fast accurate aberration bead,19.0,classification
RayRuizhiLiao/demi_mi_estimator,"PyTorch demo of ""DEMI: Discriminative Estimator of Mutual Information""",demo estimator mutual_information demi discriminative,19.0,classification
ibahbah/Boston_housing_prices_predicting,This model will then be used to estimate the best selling price for your clients' homes.,price estimate home client sell,15.0,classification
lots-of-things/gpt2-bert-reddit-bot,a bot that generates realistic replies using a combination of pretrained GPT-2 and BERT models,generate bert gpt_2 combination bot pretraine realistic reply,10.0,classification
EthanChenYZ/Time-Series-Forecast,Codes for time series forecast,time_series forecast,12.0,classification
russoale/hmr2.0,End-to-end Recovery of Human Shape and Pose with tensorflow 2.0,tensorflow_2 shape end_end human pose recovery,5.0,others
sanscript-tech/hacking-tools-scripts,Hacking Scripts that will blow your mind engineered by Hackers ♠️. ,hack engineer mind hacker blow,0.0,classification
Mangul-Lab-USC/benchmarking_SV_publication,"Updated figures for ""A benchmarking of WGS-based structural variant callers"" paper",structural benchmarke update figure variant caller wgs,5.0,others
dremovd/sibur2020-matching-baseline,Slightly changed baseline with improve performance and corrected regular expressions,performance change baseline expression correct regular,20.0,others
opeyemibami/TDD-in-MLOps,"This repo is an approach to TDD in machine learning model operation. it covers project structure, testing essentials using pytest with Git automation and other latest tools. ",structure tool cover automation operation essential pytest tdd,5.0,others
kavetinaveen/Deep-Learning-for-Semantic-Text-Matching,Deep Learning for Semantic Text Matching,deep_learning text semantic matching,1.0,prediction
RaevskyDN/aij2020-amur-noflood-public,About The model for 10-days forecasting of water levels in the Amur river,water level forecasting day amur river,2.0,prediction
krassowski/computational-notebooks-for-biomedical-research,NGSeminar on the use of Jupyter and R notebooks in biomedical research,biomedical research ngseminar,14.0,classification
rasbt/stat451-machine-learning-fs20,STAT 451: Intro to Machine Learning @ UW-Madison (Fall 2020),intro madison stat uw fall_2020,2.0,prediction
dglai/KDD20-Hands-on-Tutorial,Scalable Graph Neural Networks with Deep Graph Library,library network deep graph graph_neural scalable,21.0,classification
hyunjoonbok/PySpark,PySpark functions and utilities with examples. Assists ETL process of data modeling,process function modeling pyspark etl utility,18.0,others
juhannam/gct634-2020,Code repository for GCT634/AI613 Musical Applications of Machine Learning (Fall 2020),musical fall_2020 ai613 gct634,2.0,prediction
Spidy20/python_best_practice,In this repository I have uploaded best and useful codes of python. Fork & star this repository.,star upload fork,6.0,classification
liangqiyao990210/Quantum-Deep-Learning,"Recent advances in many fields have accelerated the demand for classification, regression, and detection problems from few 2D images/projections. Often, the heart of these modern techniques utilize neural networks, which can be implemented with deep learning algorithms. In our neural network architecture, we embed a dynamically programmable quantum circuit, acting as a hidden layer, to learn the correct parameters to correctly classify handwritten digits from the MNIST database. By starting small and making incremental improvements, we successfully reach a stunning ~95% accuracy on identifying previously unseen digits from 0 to 7 using this architecture!",architecture digit programmable stunning,4.0,others
rpautrat/LISRD,Local Invariance Selection at Runtime for Descriptors  (LISRD),selection descriptor local invariance runtime lisrd,1.0,prediction
jayleicn/recurrent-transformer,[ACL 2020] PyTorch code for MART: Memory-Augmented Recurrent Transformer for Coherent Video Paragraph Captioning,memory acl_2020 recurrent augment coherent captioning mart paragraph,3.0,classification
madhavthaker/spotify-recommendation-system,Spotify recommendation system that recommends new songs for your playlist,recommendation song spotify playlist recommend,6.0,classification
Eligijus112/Vilnius-weather-LSTM,Repository for the analysis of Vilnius weather using tensorflow,analysis tensorflow weather vilnius,2.0,prediction
pschaldenbrand/AniPainter,Animate a given video by using a robot to paint each frame.  Frames are converted into brush strokes using a novel stroke-based rendering algorithm.,animate robot stroke frame brush paint rendering,9.0,classification
MachineLP/TensorFlowTTS_chinese,chinese tts,chinese tts,27.0,prediction
aniruddha27/Information-Extraction-using-Python,A notebook to understand the concept of Information Extraction using NLP techniques in Python. ,information technique nlp extraction concept,21.0,classification
phylypo/TimeSeriesPrediction,Time Series Prediction,time_series prediction,27.0,prediction
trungtruc123/Review_Product_Lazada,use BERT evaluate product in comment of client,evaluate bert product comment client,9.0,classification
BINPIPE/docker-for-ml,Using Docker for Machine Learning Workflows,machine_learning docker workflow,27.0,prediction
anoopmsivadas/android-malware-detection,Android Malware Detection Using Machine Learning Classifiers ( Using Permissions requested by Apps),permission detection classifier app android malware request,0.0,classification
mcbarlowe/nhl_analysis,Repo to collect my analysis on hockey data,data analysis collect hockey,26.0,classification
alexeybokhovkin/CAD-Deform,Code used in the research project CAD-Deform: Deformable Fitting of CAD Models to 3D Scans,scan fitting cad deform deformable,4.0,others
ChuanyuXue/BDCI-2020-TimeSeries-Prediction,Matrix Factorization for High-Dimensional and Sparse Time Series Prediction,time_series prediction matrix sparse factorization dimensional,12.0,classification
pythoninchemistry/intro_python_chemists,"An open-source, online textbook introducing Python programming to chemistry students",programming online chemistry student textbook introduce,6.0,classification
LeejwUniverse/RL_Rainbow_Pytorch,Implementation of 6 DQN extension methods using Pytorch. (RAINBOW),method pytorch extension dqn rainbow,2.0,prediction
project-looo/looo,List Of Open-source Organizations,list organization,2.0,prediction
savinteachingorg/pTSAFall2020,NYU Probabilistic time series analysis Fall: 2020,analysis time_series probabilistic fall_2020 nyu,2.0,prediction
crazycloud/Handwritten-text-Detection-Detectron2,Handwritten text detection in document images using Detectron2,image detection handwritten_text detectron2 document,15.0,classification
remis/mining-discovery-with-deep-learning, Mining and tailings dam detection in satellite imagery using deep learning ,detection satellite imagery dam tailing,9.0,classification
yhilpisch/aiif,Jupyter Notebooks and code for the book Artificial Intelligence in Finance (O'Reilly) by Yves Hilpisch.,book artificial_intelligence finance o_reilly hilpisch yve,25.0,classification
AyanGadpal/Document-Image-Augmentation,Document Image Augmentation is tool for Augmenting axis align document images,image tool document augment align augmentation axis,12.0,classification
IITGuwahati-AI/Paper-discussions,Papers discussed in the meetings of IITG.ai with summaries and resources.,summary ai resource discuss iitg meeting,27.0,prediction
GeostatsGuy/MachineLearning_StudentProjects,My graduate students complete Machine Learning projects that they have agreed to share.,student share agree graduate,27.0,prediction
Sreekiranar/box_detection_opencv,This Repository contains a Jupyter notebook explaining how to detect checkboxes/table cells from a scanned image,explain detect table scan cell checkboxe,4.0,others
pypest/pyemu_pestpp_workflow,demonstration of pyEMU and pest++ workflow with a mf6 freyberg model,demonstration workflow freyberg mf6 pest pyemu,1.0,prediction
dcato98/fastsparse,"Fastai+PyTorch implementation of sparse model training methods (SET, SNFS, RigL) + customize-your-own.",method set training fastai sparse customize rigl snfs,24.0,prediction
JackJacquier/python-for-finance,Python for Finance module for Imperial MSc in Mathematics and Finance,finance msc module imperial mathematic,27.0,prediction
prateek-senapati/COVID-19-India-EDA,"Use of data analysis and visualisation to analyse the effects of the ongoing COVID-19 pandemic in India, and create visualisations for important observations made during the analysis.",analysis observation india pandemic analyse ongoing visualisation,12.0,classification
bryandlee/stylegan2-encoder-pytorch,PyTorch Implementation of In-Domain GAN Inversion for StyleGAN2,pytorch gan domain stylegan2 inversion,4.0,others
ZJU-Robotics-Lab/DPCN,"The official code implementation of ""Deep Phase Correlation for End-to-End Heterogeneous Sensor Measurements Matching"", CoRL2020.",phase end_end correlation sensor heterogeneous match measurement corl2020,10.0,classification
malteos/aspect-document-similarity,"Implementation, trained models and result data for the paper ""Aspect-based Document Similarity for Research Papers"" #COLING2020",train similarity research_paper document aspect coling2020,5.0,others
matsuren/omnimvs_pytorch,"An unofficial PyTorch implementation of ICCV 2019 paper  ""OmniMVS: End-to-End Learning for Omnidirectional Stereo Matching""",end_end stereo matching iccv omnidirectional omnimvs,1.0,prediction
cmd23333/Faster-rcnn-tensorflow2.x,An implement of origin faster-rcnn based on tensorflow 2.x and visualize it.使用Tensorflow2.x实现了faster-rcnn并可视化算法运行流程,tensorflow_2 visualize fast rcnn tensorflow2 origin,9.0,classification
entiretydotai/Meetup-Content,Entirety.ai Intuition to Implementation Meetup Content.,ai content intuition meetup entirety,9.0,classification
vicaws/arbitragerepair,Python modules and jupyter notebook examples for the paper Detect and Repair Arbitrage in Price Data of Traded Options.,option price trade detect module arbitrage repair,0.0,classification
nuageklow/WWCodePython_BeginnerSeries,WWCode Python - Beginner Python Study Group Series,series study_group beginner wwcode,3.0,classification
Crio-Bytes/Miscellaneous,Master repo regarding Miscellaneous MicroBytes.,master microbyte miscellaneous,17.0,classification
QuickLearner171998/Facial-Expression-Recognition,Facial Expression Recognition with Keras,recognition kera facial_expression,14.0,classification
albertqjiang/INT,Official code for paper: INT: An Inequality Benchmark for Evaluating Generalization in Theorem Proving,benchmark generalization inequality evaluating prove theorem,19.0,classification
DataXujing/YOLO-v5,:art: Pytorch YOLO v5 训练自己的数据集超详细教程！！！ :art: (提供PDF训练教程下载）,yolo pdf v5 art,17.0,classification
scottemmons/sgm,Sparse Graphical Memory for Robust Planning,memory robust sparse planning graphical,3.0,classification
deepampatel/TwinBert,pytorch implementation of the TwinBert paper ,paper pytorch,18.0,others
jbarton311/coronavirus-analysis,Scripts to help pull & analyze Coronavirus data,data analyze coronavirus pull,3.0,classification
AlexanderNixon/Machine-learning-reads,Code from posts on my medium blog ,post medium blog,23.0,classification
mallikarjunyadav27/RFM_Analysis,"RFM (Recency, Frequency, Monetary) analysis is a proven marketing model for behavior based customer segmentation. It groups customers based on their transaction history – how recently, how often and how much did they buy. RFM helps divide customers into various categories or clusters to identify customers who are more likely to respond to promotion.",customer rfm divide proven recency respond,27.0,prediction
Glorf/recipenlg,Set of scripts and notebooks used to produce results visible in RecipeNLG paper,paper set produce recipenlg visible,18.0,others
gustheman/transfer_learning_tfhub,Content to learn how to apply transfer learning using models from TensorFlow Hub,learning learn content apply tensorflow transfer hub,14.0,classification
the-machine-preacher/Pythonic-Python-Tutorial,Learn Python! Python is a programming language that lets you work quickly and integrate systems more effectively.,learn integrate effectively programming_language,24.0,prediction
ronnyfahrudin/IYKRA-FELLOWSHIP-Data-Science,This is my notebook about data science learn from data science fellowship iykra,learn data_science fellowship iykra,4.0,others
hellotinah/youtube_sentiment_analysis,Youtube comments sentiment analysis,comment sentiment_analysis youtube,6.0,classification
jjrodcast/MaskDectector,This repository contains an implementación to detect people with mask to prevent from COVID-19,detect covid_19 people mask implementaci prevent,0.0,classification
dhinojosa/machine-learning-data-pipelines,Machine Learning Data Pipelines Presentation,data machine_learning pipeline presentation,5.0,others
vasishtduddu/GraphLeaks,"Code for the paper ""Quantifying Privacy Leakage in Graph Embedding"" published in MobiQuitous 2020",graph publish embed privacy quantify leakage mobiquitous,21.0,classification
Gamut73/Gibbs,Pirate the Carribean more easily.,easily carribean pirate,5.0,others
ampas/aces-vwg-gamut-mapping-2020,ACES - Virtual Working Group - Gamut Mapping - 2020,group mapping virtual ace gamut,4.0,others
Mentos05/SAS_DeepLearning,Private repository with personal work on deep learning topics with SAS software. This is not an official SAS repository!,personal topic software private sas,17.0,classification
fahd09/OpenBCI-visual-discrimination-exp,Experimenting with NodeJS and OpenBCI,experiment openbci nodejs,8.0,classification
pwwang/python-import-system,Python import system diagram,diagram import,15.0,classification
quocdat32461997/NER,Implementation of BiLSTM-CRF in TF2.0 for Name-Entity-Recognition (NER),crf name_entity recognition tf2 ner bilstm,21.0,classification
ninuannvarghese/recomendation-engine,Python Based Recommendation Engine,recommendation engine,24.0,prediction
selflein/GraphNN-Multi-Object-Tracking,"Unofficial PyTorch implementation of ""Learning a Neural Solver for Multiple Object Tracking""",learn object pytorch neural multiple tracking solver,3.0,classification
thinkingmachines/geoai-immap,Mapping Informal Settlements in Colombia using Machine Learning,map colombia informal settlement,10.0,classification
tiwarylab/LSTM-predict-MD,Learning Molecular Dynamics with Simple Language Model built upon Long Short-Term Memory Neural Network,learn neural_network build language memory short_term dynamic molecular,3.0,classification
jeffheaton/pretrained-gan-70s-scifi,Pretrained model 1024x1024 trained on 1970s scifi art,train pretraine art 1024x1024 scifi,17.0,classification
jeffheaton/pretrained-gan-fish,"Pretrained model for fish, 256x256",pretraine 256x256 fish,14.0,classification
misinfosecproject/amitt_counters,Repo replaced by cogsec-collaborative/AMITT,collaborative amitt cogsec replace,6.0,classification
christophostertag/SAR-Python,Search and Rescue with Airborne Optical Sectioning implemented in Python with OpenCv and PyTorch,search opencv optical airborne rescue sectioning,8.0,classification
fastai/tweetrel,Use GitHub Actions to send a tweet when you make a new release,tweet action release send,26.0,classification
nguyenhoa93/GradCAM_and_GuidedGradCAM_tf2,Implementation of GradCAM & Guided GradCAM with Tensorflow 2.x,tensorflow_2 guide,27.0,prediction
IhabBendidi/sentiment_embeddings,A scientific benchmark and comparison of the performance of sentiment analysis models in NLP on small to medium datasets,comparison dataset nlp medium performance sentiment_analysis benchmark scientific,4.0,others
nealgravindra/self-supervsed_edge_feats,"code for ""Self-supervised edge features for improved Graph Neural Network training"", <arxivlink>",feature network training edge supervise graph_neural arxivlink,19.0,classification
ICWallis/geothermal-cookbook,"Python methods for geoscientists, geochemists and reservoir engineers working in geothermal resources.",method resource engineer reservoir geoscientist geochemist geothermal,0.0,classification
yeanwei97/DSEU,Single Image Dehazing: Dilated Squeeze-and-Excitation U-net (DSEU),u_net single excitation squeeze dehazing dilate dseu,17.0,classification
priyanshux/cryptopy,Cryptocurrency price prediction and recommendation,recommendation price_prediction cryptocurrency,6.0,classification
dirkhovy/text_analysis_for_social_science,Code for the book on python for social scientists,book social scientist,12.0,classification
arunnthevapalan/diabetes-prediction-app,Streamlit Web App to predict the onset of diabetes based on diagnostic measures,predict streamlit measure web_app diabete diagnostic onset,14.0,classification
its-harshil/Hacktoberfest_2020,Repository designed for beginner to contribute to open-source.,design beginner contribute,3.0,classification
awarelab/spinningup_tf2,This repository includes ports of the algorithms from Spinning Up in Deep RL to TensorFlow v2,deep tensorflow rl v2 port spin,14.0,classification
tanishqgautam/Lung-Segmentation-With-Keras,Lung Segmentation using U-NET Architecture,architecture segmentation u_net lung,24.0,prediction
chenmingxiang110/NCA_Prediction,This repo provides the code to replicate the experiments in the paper: Predicting Geographic Information with Neural Cellular Automata.,predict information experiment neural replicate cellular geographic automata,19.0,classification
klfoulk16/learning_pandas,I worked through 100 Pandas Puzzles (actually only 45) and did some data visualizations with the 2010 Denver Census data.,data visualization census pandas denver puzzle,4.0,others
mayalenE/holmes,Source code for the paper Hierarchically Organized Latent Modules for Exploratory Search in Morphogenetic Systems,search latent module exploratory hierarchically morphogenetic organized,10.0,classification
SajjadAsefi/PSSE,Power system state estimation IEEE 14 Bus (Python code),power estimation state ieee bus,10.0,classification
danuker/symreg,A Symbolic Regression engine,regression engine symbolic,24.0,prediction
SimronThapa/FSRN-CVPR2020,This codebase implements the system described in the paper: Dynamic Fluid Surface Reconstruction Using Deep Neural Network,neural_network dynamic deep reconstruction surface codebase fluid,26.0,classification
fkubota/kaggle-Mechanisms-of-Action-MoA-Prediction,Mechanisms of Action (MoA) Prediction コンペのリポジトリ,prediction mechanism action moa,27.0,prediction
nicknochnack/TimeSeriesForecastingProphet,A simple Jupyter Notebook walking through how to perform time series forecasting with Facebook Prophet. ,perform time_series facebook forecasting prophet walk,2.0,prediction
SullyChen/Molecular-Solubility-with-PyTorch-Geometric,This code trains a graph convolutional network in Torch Geometric to predict the solubility of molecules,predict train convolutional graph molecule geometric solubility torch,23.0,classification
eugenet12/pytorch-rbm-autoencoder,Pytorch implementation of an autoencoder built from pre-trained Restricted Boltzmann Machines (RBMs) ,build autoencoder pre_trained machine boltzmann rbms restricted,24.0,prediction
yuki678/driving-object-detection,Traffic Light detection using Tensorflow Object Detection API v1 and v2,detection object_detection tensorflow traffic api light v2 v1,28.0,classification
as791/Adversarial-Example-Attack-and-Defense,This repository contains the rough implementation of three adversarial example attack methods and one defense against all using MNIST dataset.,method mnist_dataset adversarial_attack defense rough,14.0,classification
byin-cwi/SRNN-ICONs2020,"In this repo, Spiking recurrent neural network is applied on various task for ICONs2020",network recurrent_neural apply task spike icons2020,1.0,prediction
adriaan90/twitter-bot,A collection of different functions that can be performed by a Twitter bot,perform function a_collection twitter bot,13.0,classification
Global-Policy-Lab/gpl-covid,Repo for code and small datasets related to Global Policy Lab's COVID-19 policy analysis. Read and share the acompanying article here:,read article lab global policy share acompanye,28.0,classification
gandalf012/SentenceBert-20newsgroup-Classifier,Classification pipeline based on sentenceTransformer and Facebook nearest-neighbor search library,library pipeline search classification facebook neighbor sentencetransformer,2.0,prediction
karpathy/micrograd,A tiny scalar-valued autograd engine and a neural net library on top of it with PyTorch-like API,library engine api tiny neural_net autograd scalar,24.0,prediction
Linear95/CLUB,Code for ICML2020 paper - CLUB: A Contrastive Log-ratio Upper Bound of Mutual Information,mutual_information log bind ratio club icml2020 contrastive upper,0.0,classification
BY571/DQN-Atari-Agents,"DQN-Atari-Agents:   Modularized & Parallel PyTorch implementation of several DQN Agents, i.a. DDQN, Dueling DQN, Noisy DQN, C51, Rainbow, and DRQN",agent dqn c51 ddqn drqn modularize,2.0,prediction
hse-econ-data-science/dap_2020_fall,"Data Analysis with Python, Анализ данных на python",data analysis,2.0,prediction
muellerzr/fastai2-Starlette,A Starlette example for deployment in fastai2,fastai2 deployment starlette,15.0,classification
badriadhikari/Algorithms-2020fall,Advanced Data Structures & Algorithms (CS 5130),data structure advanced algorithms,13.0,classification
ml-jku/mgenerators-failure-modes,Shows some of the ways molecule generation and optimization can go wrong,optimization generation molecule wrong,0.0,classification
aws-samples/aws-machine-learning-university-dte,Machine Learning University: Decision Trees and Ensemble Methods,method machine_learning tree ensemble decision university,14.0,classification
Valentyn1997/xray,Unsupervised Anomaly Detection for X-Ray Images,image anomaly_detection unsupervised x_ray,12.0,classification
LowriWilliams/Aspect_Sentiment_Analysis,An investigation into sentiment analysis and topic modelling techniques.,technique investigation sentiment_analysis topic modelling,15.0,classification
